<?xml version="1.0"?>
<!DOCTYPE chat SYSTEM "../dtd/private_chat.dtd">
<chat>
  <messaggio id="m_64f2a1b3c4d5e.12345678" mittente="admin" destinatario="luisa" data="2025-08-12 13:18:58" risposta="1" sollecito_inviato="0" admin_id="9">
    <testo><![CDATA[l'abbonamento sta per scadere il 2026-07-01, vuoi rinnovarlo?]]></testo>
  </messaggio>
  <messaggio id="m_64f2a1b5f6a7b.23456789" mittente="luisa" destinatario="admin" data="2025-08-12 13:19:06" risposta="1" sollecito_inviato="0">
    <testo><![CDATA[ok grazie, lo faccio stasera]]></testo>
  </messaggio>
  <messaggio id="m_64f2a2c3d4e6f.34567890" mittente="luisa" destinatario="admin" data="2025-08-17 14:47:53" risposta="1" sollecito_inviato="0">
    <testo><![CDATA[a che ora è Zumba oggi?]]></testo>
  </messaggio>
  <messaggio id="m_64f2a2d7e8f90.45678901" mittente="admin" destinatario="luisa" data="2025-08-17 14:48:54" risposta="1" sollecito_inviato="0" admin_id="9">
    <testo><![CDATA[18:00 in sala grande — ti ho lasciato 2 posti riservati fino alle 17:30]]></testo>
  </messaggio>
  <messaggio id="m_64f2a2e9f0a11.56789012" mittente="luisa" destinatario="admin" data="2025-08-17 14:49:17" risposta="1" sollecito_inviato="0">
    <testo><![CDATA[perfetto, grazie!]]></testo>
  </messaggio>
  <messaggio id="m_64f3b11a22b33.67890123" mittente="root" destinatario="mario" data="2025-09-02 12:00:00" risposta="1" sollecito_inviato="0" admin_id="10">
    <testo><![CDATA[Sto verificando gli accessi; controllo il tuo abbonamento e ti aggiorno]]></testo>
  </messaggio>
  <messaggio id="m_64f3b12c33d44.78901234" mittente="mario" destinatario="root" data="2025-09-02 12:01:20" risposta="1" sollecito_inviato="0">
    <testo><![CDATA[grazie, fammi sapere se serve altro]]></testo>
  </messaggio>
  <messaggio id="m_64f3b13d44e55.89012345" mittente="root" destinatario="mario" data="2025-09-02 12:05:33" risposta="1" sollecito_inviato="0" admin_id="10">
    <testo><![CDATA[Tutto ok: abbonamento attivo fino al 2026-01-01. Ho abilitato il log per i tuoi accessi di ieri.]]></testo>
  </messaggio>
  <messaggio id="m_64f4c21e55f66.90123456" mittente="admin" destinatario="gianni" data="2025-06-15 18:35:05" risposta="1" sollecito_inviato="0" admin_id="9">
    <testo><![CDATA[Hai segnalato problemi con le prenotazioni — abbiamo aperto un ticket tecnico.]]></testo>
  </messaggio>
  <messaggio id="m_64f4c22f66g77.01234567" mittente="gianni" destinatario="admin" data="2025-06-15 18:37:22" risposta="1" sollecito_inviato="0">
    <testo><![CDATA[ok grazie, attendo aggiornamenti]]></testo>
  </messaggio>
  <messaggio id="m_64f4c23077h88.12345098" mittente="admin" destinatario="gianni" data="2025-06-16 09:10:00" risposta="1" sollecito_inviato="0" admin_id="9">
    <testo><![CDATA[Il problema è stato risolto: prova a svuotare la cache dell'app e riaprire.]]></testo>
  </messaggio>
  <messaggio id="m_64f5d31a88i99.23456109" mittente="admin" destinatario="alice" data="2025-08-20 08:05:10" risposta="1" sollecito_inviato="0" admin_id="1">
    <testo><![CDATA[Ci sono ancora 5 posti per il Circuito Brucia Grassi di stasera, vuoi che la prenoti?]]></testo>
  </messaggio>
  <messaggio id="m_64f5d32b99j00.34567210" mittente="alice" destinatario="admin" data="2025-08-20 08:06:30" risposta="1" sollecito_inviato="0">
    <testo><![CDATA[Sì per favore, grazie!]]></testo>
  </messaggio>
  <messaggio id="m_64f5d33c00k11.45678321" mittente="admin" destinatario="alice" data="2025-08-20 08:07:00" risposta="1" sollecito_inviato="0" admin_id="1">
    <testo><![CDATA[Fatto — sei prenotata. Ti ho inviato il promemoria 1 ora prima.]]></testo>
  </messaggio>
  <messaggio id="m_64f6e41d11l22.56789432" mittente="admin" destinatario="bob" data="2025-09-13 09:55:23" risposta="1" sollecito_inviato="0" admin_id="9">
    <testo><![CDATA[Di solito l'abbonamento non è trasferibile; possiamo però aggiungere un guest per una lezione]]></testo>
  </messaggio>
  <messaggio id="m_64f6e42e22m33.67890543" mittente="bob" destinatario="admin" data="2025-09-13 09:58:00" risposta="1" sollecito_inviato="0">
    <testo><![CDATA[Perfetto, allora aggiungi Marco Rossi come guest per la lezione di domani.]]></testo>
  </messaggio>
  <messaggio id="m_64f6e43f33n44.78901654" mittente="admin" destinatario="bob" data="2025-09-13 10:10:05" risposta="1" sollecito_inviato="0" admin_id="9">
    <testo><![CDATA[Guest aggiunto — Marco riceverà un'email di conferma.]]></testo>
  </messaggio>
  <messaggio id="m_64f7f51g44o55.89012765" mittente="root" destinatario="carla" data="2025-09-07 08:25:10" risposta="1" sollecito_inviato="0" admin_id="10">
    <testo><![CDATA[Ti ho inviato il link di pagamento per il rinnovo — attiva l'abbonamento quando ricevi conferma.]]></testo>
  </messaggio>
  <messaggio id="m_64f7f52h55p66.90123876" mittente="carla" destinatario="root" data="2025-09-07 10:00:00" risposta="1" sollecito_inviato="0">
    <testo><![CDATA[Pagamento effettuato, grazie!]]></testo>
  </messaggio>
  <messaggio id="m_64f7f53i66q77.01234987" mittente="root" destinatario="carla" data="2025-09-07 10:05:00" risposta="1" sollecito_inviato="0" admin_id="10">
    <testo><![CDATA[Confermo: scadenza aggiornata a 2025-12-07.]]></testo>
  </messaggio>
  <messaggio id="m_64f8g61j77r88.12345098" mittente="admin" destinatario="dario" data="2025-09-13 07:05:00" risposta="1" sollecito_inviato="0" admin_id="9">
    <testo><![CDATA[La meditazione è lunedì e giovedì 07:30-08:00 in sala piccola]]></testo>
  </messaggio>
  <messaggio id="m_64f8g62k88s99.23456109" mittente="dario" destinatario="admin" data="2025-09-13 07:06:30" risposta="1" sollecito_inviato="0">
    <testo><![CDATA[Perfetto, grazie!]]></testo>
  </messaggio>
  <messaggio id="m_64f9h71l99t00.34567210" mittente="admin" destinatario="alice" data="2025-09-10 09:00:00" risposta="0" sollecito_inviato="0" admin_id="1">
    <testo><![CDATA[Promemoria: il corso speciale di sabato è confermato alle 10:00.]]></testo>
  </messaggio>
  <messaggio id="m_64f9h72m00u11.45678321" mittente="admin" destinatario="luisa" data="2025-09-10 09:00:00" risposta="1" sollecito_inviato="0" admin_id="1">
    <testo><![CDATA[Promemoria: il corso speciale di sabato è confermato alle 10:00.]]></testo>
  </messaggio>
  <messaggio id="m_64f9h73n11v22.56789432" mittente="admin" destinatario="bob" data="2025-09-10 09:00:00" risposta="0" sollecito_inviato="0" admin_id="1">
    <testo><![CDATA[Promemoria: il corso speciale di sabato è confermato alle 10:00.]]></testo>
  </messaggio>
  <messaggio id="m_68d284c76a84b9.12067599" mittente="luisa" destinatario="admin" data="2025-09-23 13:30:15" risposta="1" sollecito_inviato="0">
    <testo><![CDATA[ok]]></testo>
  </messaggio>
  <messaggio id="m_68d284c895e9e5.47645236" mittente="luisa" destinatario="admin" data="2025-09-23 13:30:16" risposta="1" sollecito_inviato="0">
    <testo><![CDATA[ok]]></testo>
  </messaggio>
</chat>
